{
  "requirementRelations" : [ {
    "requirementRelationshipType" : "RequirementSpecialismOfRequirement",
    "relatedRequirementId" : "urn:uuid:e6b31BC2-8102-64AF-034D-C2DC35E37cEE"
  } ],
  "requirementId" : "urn:uuid:48878d48-6f1d-47f5-8ded-a441d0d879df",
  "requirementInformation" : {
    "foreignId" : "3.1.1",
    "longname" : "Plastic deformation of the bogie",
    "versionPredecessor" : {
      "versionPredecessorNumber" : "1.4.5",
      "versionPredecessorId" : "5aBE533c-518F-1109-BFa9-E22ABeBD3Bf4"
    },
    "reqIfName" : "Plastic deformation of the bogie",
    "reqIfType" : "Functional",
    "metadata" : [ {
      "value" : "2025-11-30T00:00:00.000+02:00",
      "metadataDescription" : "Timestamp of the expected finalization of the requirement",
      "key" : "ExpectedFinalization"
    } ],
    "author" : "Lisa Dr√§xlmaier GmbH",
    "description" : "eOMtThyhVNLWUZNRcBaQKxI",
    "specification" : [ "https://www.prostep.org/fileadmin/prod-pay-download-8c1d/Recommendation_ReqIF_V2.2.pdf" ],
    "creationDate" : "2025-10-31T17:12:10.424Z",
    "version" : {
      "versionNumber" : "2.0.0",
      "versionId" : "e5Cd14Af-123f-C9D5-0fa2-8CEcc5AD60F6"
    }
  },
  "requirementStatus" : {
    "customerStatus" : [ {
      "customerStatusComment" : "Requirement needs to be evaluated",
      "customerStatusValue" : "<empty>",
      "customerStatusTimestamp" : "2025-10-31T17:12:10.427Z"
    } ],
    "supplierStatus" : [ {
      "supplierStatusTimestamp" : "2025-10-31T17:12:10.427Z",
      "supplierStatusValue" : "<empty>",
      "supplierStatusComment" : "More information needed from customer"
    } ],
    "statusValue" : "transition status",
    "statusTimestamp" : "2025-10-31T17:12:10.427Z"
  }
}